{
  "task_id": "memory",
  "version": 1,
  "title": "Peak allocated memory at validation BPB < 1.05",
  "supersedes": "nanogpt-t105-memory",
  "substrate": {
    "id": "karpathy-autoresearch-v1",
    "source": "https://github.com/karpathy/autoresearch",
    "revision": "716857590764cc458562d3483a7279fc6ae6edb6",
    "prepare": [
      "uv",
      "run",
      "prepare.py"
    ],
    "entrypoint": [
      "uv",
      "run",
      "train.py"
    ],
    "mutable": [
      "train.py"
    ],
    "immutable": [
      "prepare.py",
      "pyproject.toml",
      "uv.lock"
    ],
    "gpu_work_witness": "Parameter counts:",
    "frozen_regions": [
      {
        "file": "train.py",
        "region": "GPU-work witness after model allocation",
        "anchor": "print(\"Parameter counts:\")",
        "reason": "Preserve the parameter-count print block after model allocation and before training. This witness makes launches chargeable, including failures after GPU work starts."
      },
      {
        "file": "train.py",
        "region": "Canonical reporting call and its arguments",
        "anchor": "report_efficiency_metrics(",
        "reason": "Preserve this single call to prepare.py's report_efficiency_metrics as the only path that produces official numbers. Pass the model that was actually trained -- the same object prepare.py counts and validates here -- together with the actual tokenizer, step count, tokens per step, summed tokens and durations, unscaled: the reporter records the counts and durations you pass exactly as passed. Pass flops_measured as this run's unmodified measure_flops_dispatch return value and nothing else. This task builds no harness, so pass harness=None. Do not skip or shorten a probe, call the reporter more than once, or print a METRICS_JSON line of your own."
      },
      {
        "file": "train.py",
        "region": "FLOPs probe invocation, inputs and returned value",
        "anchor": "flops_per_token_measured = measure_flops_dispatch(",
        "reason": "Probe the actual candidate model, in its training configuration, using the first actual training microbatch; prepare.py selects its first min(8, microbatch sequences) complete sequences. measure_flops_dispatch must remain prepare.py's function: do not shadow, wrap, reimplement or monkey-patch it, do not independently slice or replace probe inputs, do not substitute a cheaper or differently configured model or computation for the probe, and do not probe repeatedly and choose a result. The integer this one call returns is the only value that may reach report_efficiency_metrics(flops_measured=...): do not reassign, scale, round, recompute or hand-write it, and do not drop the argument. prepare.py records whatever number train.py passes, so this rule is the entire check. Changing the actual training microbatch size remains allowed."
      }
    ],
    "known_constraints": [
      "prepare.py must measure the run that actually happened. measure_flops_dispatch, harness.tick and report_efficiency_metrics must all be given the same model this launch trained. Use prepare.py unmodified, and leave the counters it reads alone. For example, torch.cuda.reset_peak_memory_stats() silently lowers peak_vram_bytes.",
      "The METRICS_JSON line prepare.py prints is the only official output. Do not print one of your own: the engine takes the last such line in stdout, so anything printed after the reporter is what gets scored.",
      "Every count and duration passed to report_efficiency_metrics must describe work this launch actually did: one step per completed optimizer update including its accumulation microbatches, the tokens actually consumed counting repetitions, and synchronized durations covering each whole update.",
      "train.py must not read the validation split.",
      "If your model computes arithmetic the FLOPs probe cannot see during training -- a third-party or hand-written kernel that never reaches aten dispatch -- you must make it countable. prepare.py already does this for flash_attn_func: it wraps the call and tallies the arithmetic from the shapes it was given. Do the same for your own, either by that route or by registering a flop formula for a custom op. An operation the probe cannot count is not free. The decode path is not FLOPs-counted, so a kernel used only there needs no formula.",
      "Stop when the training clock reaches TIME_BUDGET. Count that clock the way the reference does: training work only, not compilation or evaluation, and skipping the first ten updates."
    ]
  },
  "launch": {
    "train_seconds": 600,
    "gpus_per_launch": 1,
    "accelerator": "NVIDIA_A100_80GB",
    "seed": 42,
    "timeout_seconds": 1800
  },
  "budget": {
    "max_launches": 100,
    "includes_failures": true,
    "includes_reference_launch": true,
    "charging_rule": "gpu-work-witness"
  },
  "metrics": {
    "val_bpb": {
      "type": "number",
      "unit": "bits/byte",
      "deterministic": false,
      "description": "Validation bits per byte on fixed held-out data, computed by evaluate_bpb in prepare.py. Quality is an eligibility threshold, not a ranking target.",
      "extract": {
        "kind": "metrics_json",
        "field": "val_bpb"
      }
    },
    "flops_per_token_measured": {
      "type": "integer",
      "unit": "FLOPs/token",
      "deterministic": true,
      "description": "Forward-and-backward FLOPs per token from executed operations and registered shape-based counting formulas on the uncompiled model. Counts matrix, convolution and attention work; excludes optimizer updates and unregistered operations, including elementwise and normalization work.",
      "extract": {
        "kind": "metrics_json",
        "field": "flops_per_token_measured"
      }
    },
    "peak_vram_bytes": {
      "type": "integer",
      "unit": "bytes",
      "deterministic": false,
      "description": "Peak PyTorch-allocated CUDA memory from process setup through the reporting read, including the FLOPs probe, training and validation. Validation runs at a frozen 128 x 2048, so on a candidate whose training peak is small the evaluation forward can become the maximum; making that forward cheap at the frozen shape is part of the axis. Not total device memory or reserved allocator memory.",
      "extract": {
        "kind": "metrics_json",
        "field": "peak_vram_bytes"
      }
    },
    "training_data_tokens_available": {
      "type": "integer",
      "unit": "tokens",
      "deterministic": true,
      "description": "Configured token-position budget of the fixed shuffled training-data pool. Available data, not a measurement of unique positions actually consumed.",
      "extract": {
        "kind": "metrics_json",
        "field": "training_data_tokens_available"
      }
    },
    "total_tokens": {
      "type": "integer",
      "unit": "tokens",
      "deterministic": false,
      "description": "Completed optimizer updates multiplied by actual constant tokens per update, including accumulation microbatches, warmup updates and repeated token uses.",
      "extract": {
        "kind": "metrics_json",
        "field": "total_tokens"
      }
    },
    "num_params_total": {
      "type": "integer",
      "unit": "parameters",
      "deterministic": true,
      "description": "Exact total parameter count of the model, counted by the immutable instrument.",
      "extract": {
        "kind": "metrics_json",
        "field": "num_params_total"
      }
    }
  },
  "objective": {
    "comparison_mode": "gated",
    "target": {
      "metric": "peak_vram_bytes",
      "direction": "minimize"
    },
    "quality_gate": {
      "metric": "val_bpb",
      "operator": "<",
      "value": 1.05
    },
    "tiebreaks": [
      {
        "metric": "total_tokens",
        "direction": "minimize"
      }
    ],
    "constraints": [
      {
        "metric": "flops_per_token_measured",
        "operator": "<=",
        "value": 239078400,
        "basis": "Reference counted forward-and-backward FLOPs per token; prevents gains bought with more counted arithmetic."
      },
      {
        "metric": "num_params_total",
        "operator": "<=",
        "value": 50332176,
        "basis": "Reference total parameter count; prevents gains bought with a larger model."
      },
      {
        "metric": "training_data_tokens_available",
        "operator": "==",
        "value": 631241817,
        "basis": "Pin the prescribed complete shuffled training-data pool; repeated use remains allowed."
      }
    ]
  },
  "reference_launch": {
    "position": 1,
    "assert_exact": {
      "flops_per_token_measured": 239078400,
      "training_data_tokens_available": 631241817
    }
  },
  "report": {
    "headline": "peak_vram_bytes",
    "headline_direction": "minimize",
    "columns": [
      "val_bpb",
      "peak_vram_bytes",
      "flops_per_token_measured",
      "training_data_tokens_available",
      "total_tokens",
      "num_params_total"
    ]
  }
}
